{
  "valid": true,
  "policyFingerprint": "<fingerprint>",
  "policyCount": 1,
  "policies": [
    {
      "index": 0,
      "normalizedRuleCount": 2
    }
  ],
  "normalizedRuleCount": 2,
  "domains": [
    {
      "name": "rbac_cli",
      "predicates": [
        {
          "name": "role",
          "arity": 2,
          "role": "policy_fact",
          "query": false
        },
        {
          "name": "right",
          "arity": 2,
          "role": "policy_fact",
          "query": false
        },
        {
          "name": "request",
          "arity": 2,
          "role": "edb",
          "query": false
        },
        {
          "name": "allow",
          "arity": 2,
          "role": "idb",
          "query": true
        },
        {
          "name": "can_deliver",
          "arity": 1,
          "role": "idb",
          "query": true
        }
      ],
      "atoms": [
        "Leela",
        "admin",
        "billing:read"
      ]
    }
  ]
}
